[
  {
    "facilities": [
      "food_drink",
      "daylight",
      "views",
      "large_desks",
      "free_wifi",
      "laptops_allowed",
      "sockets",
      "signal",
      "refreshments",
      "break",
      "bike_racks",
      "gender_neutral_toilets",
      "wheelchair_accessible"
    ],
    "atmosphere": [
      "modern",
      "cosy",
      "social",
      "friendly"
    ],
    "access": "Anyone (public)",
    "disabled_access": true,
    "opening_hours": {
      "monday": {
        "open": true,
        "from": "8:30",
        "to": "17:00"
      },
      "tuesday": {
        "open": true,
        "from": "8:30",
        "to": "17:00"
      },
      "wednesday": {
        "open": true,
        "from": "8:30",
        "to": "17:00"
      },
      "thursday": {
        "open": true,
        "from": "8:30",
        "to": "17:00"
      },
      "friday": {
        "open": true,
        "from": "8:30",
        "to": "17:00"
      },
      "saturday": {
        "open": false,
        "from": "",
        "to": ""
      },
      "sunday": {
        "open": false,
        "from": "",
        "to": ""
      }
    },
    "slug": "1915",
    "floor": "Ground floor",
    "restriction": "",
    "work": [
      "private",
      "close",
      "friends",
      "group"
    ],
    "space_type": "Café",
    "building": "Sir William Henry Bragg Building",
    "address": "University of Leeds, LS2 9JT",
    "location": "{\"type\":\"Point\",\"coordinates\":[-1.5543264,53.8091049]}",
    "title": "1915",
    "tags": [],
    "noise": "Background chatter",
    "restricted": false,
    "id": 10,
    "description": "1915 is based in the Sir William Henry Bragg Building on Woodhouse Lane, its relaxed and informal menu has been carefully created to offer a mix of both classic and on-trend options.",
    "published": true,
    "contacts": [
      {
        "url": "https://www.instagram.com/greatfoodleeds/",
        "link_text": "Follow Great Food at Leeds on Instagram",
        "class": "icon-instagram"
      },
      {
        "url": "https://www.facebook.com/greatfoodleeds",
        "link_text": "Follow Great Food at Leeds on Facebook",
        "class": "icon-facebook-squared"
      }
    ],
    "links": [
      {
        "url": "https://gfal.leeds.ac.uk/where-to-eat/cafes/1915/",
        "link_text": "Visit the 1915 web site",
        "class": "icon-link"
      },
      {
        "url": "https://www.leeds.ac.uk/campusmap?location=18482",
        "link_text": "View on the University campus map (map reference 53)",
        "class": "icon-uol-logo-mark"
      }
    ],
    "images": [
      {
        "url": "/assets/photos/1915.jpg",
        "alt": "Interior photograph of the 1915 Café showing high stool seating, normal seating and part of the service counter"
      }
    ],
    "lat": 53.8091049,
    "lng": -1.5543264
  }
]